data/perfiles_rol2.csv

cluster_km,viajes,distancia_mediana,duracion_mediana,velocidad_mediana,pct_fin_semana,pct_ruido,% de viajes,hora del centroide,franja dominante,zona origen dominante
0,9015,8.340162830958212,23.7,21.80925106505071,31.01497504159734,4.625623960066556,18.03,22.4,noche,13
1,13474,1.5375380863912715,8.283333333333333,11.618879083798152,24.662312602048388,1.254267478105982,26.948,9.5,valle,1
2,13124,2.2696716736039653,14.683333333333334,9.618160678484168,26.744894849131363,0.5714721121609265,26.248,16.0,pico_pm,0
3,14387,1.6009101383541835,7.183333333333334,13.867716121931991,32.45985959546813,1.2580802113018696,28.774,21.4,noche,2

README.md

Perfiles operativos (K-means, Rol 2)
Cluster	% viajes	Distancia mediana	Duración mediana	Velocidad mediana	Franja dominante
0	18.0 %	8.3 km	23.7 min	21.8 km/h	Noche (origen LaGuardia)
1	26.9 %	1.5 km	8.3 min	11.6 km/h	Valle
2	26.2 %	2.3 km	14.7 min	9.6 km/h	Pico PM
3	28.8 %	1.6 km	7.2 min	13.9 km/h	Noche